{
  "schema_version": 2,
  "context": [
    {
      "kind": "instruction",
      "instruction_id": "instruction.0",
      "opcode": "PSET_B32",
      "instruction_class": "compute",
      "form": "b32",
      "inputs": [],
      "outputs": [
        {
          "value_id": "pred.def0",
          "role": "destination",
          "dtype": "bool",
          "memory_access": null
        }
      ],
      "attributes": {},
      "source_location": {
        "source": "alias_case",
        "line": 5,
        "column": null,
        "path": "<cce>"
      }
    },
    {
      "kind": "instruction",
      "instruction_id": "instruction.1",
      "opcode": "VDUP",
      "instruction_class": "compute",
      "form": "fp32",
      "inputs": [
        {
          "value_id": "1.0f.def1",
          "role": "source",
          "dtype": "fp32",
          "memory_access": null
        },
        {
          "value_id": "pred.def0",
          "role": "predicate",
          "dtype": "bool",
          "memory_access": null
        }
      ],
      "outputs": [
        {
          "value_id": "a.def2",
          "role": "destination",
          "dtype": "fp32",
          "memory_access": null
        }
      ],
      "attributes": {},
      "source_location": {
        "source": "alias_case",
        "line": 6,
        "column": null,
        "path": "<cce>"
      }
    },
    {
      "kind": "instruction",
      "instruction_id": "instruction.2",
      "opcode": "VDUP",
      "instruction_class": "compute",
      "form": "fp32",
      "inputs": [
        {
          "value_id": "2.0f.def3",
          "role": "source",
          "dtype": "fp32",
          "memory_access": null
        },
        {
          "value_id": "pred.def0",
          "role": "predicate",
          "dtype": "bool",
          "memory_access": null
        }
      ],
      "outputs": [
        {
          "value_id": "a.def4",
          "role": "destination",
          "dtype": "fp32",
          "memory_access": null
        }
      ],
      "attributes": {},
      "source_location": {
        "source": "alias_case",
        "line": 8,
        "column": null,
        "path": "<cce>"
      }
    },
    {
      "kind": "instruction",
      "instruction_id": "instruction.3",
      "opcode": "VADD",
      "instruction_class": "compute",
      "form": "fp32",
      "inputs": [
        {
          "value_id": "a.def2",
          "role": "source",
          "dtype": "fp32",
          "memory_access": null
        },
        {
          "value_id": "a.def4",
          "role": "source",
          "dtype": "fp32",
          "memory_access": null
        },
        {
          "value_id": "pred.def0",
          "role": "predicate",
          "dtype": "bool",
          "memory_access": null
        }
      ],
      "outputs": [
        {
          "value_id": "out.def5",
          "role": "destination",
          "dtype": "fp32",
          "memory_access": null
        }
      ],
      "attributes": {},
      "source_location": {
        "source": "alias_case",
        "line": 9,
        "column": null,
        "path": "<cce>"
      }
    }
  ],
  "values": {
    "pred.def0": {
      "definition_id": "pred.def0",
      "logical_id": "pred",
      "storage": "PredicateRegister",
      "dtype": "bool",
      "shape": [],
      "producer_node_id": "instruction.0",
      "storage_object_id": null,
      "source_location": null
    },
    "1.0f.def1": {
      "definition_id": "1.0f.def1",
      "logical_id": "1.0f",
      "storage": "Scalar",
      "dtype": "fp32",
      "shape": [],
      "producer_node_id": null,
      "storage_object_id": null,
      "source_location": null
    },
    "a.def2": {
      "definition_id": "a.def2",
      "logical_id": "a",
      "storage": "Register",
      "dtype": "fp32",
      "shape": [],
      "producer_node_id": "instruction.1",
      "storage_object_id": null,
      "source_location": null
    },
    "2.0f.def3": {
      "definition_id": "2.0f.def3",
      "logical_id": "2.0f",
      "storage": "Scalar",
      "dtype": "fp32",
      "shape": [],
      "producer_node_id": null,
      "storage_object_id": null,
      "source_location": null
    },
    "a.def4": {
      "definition_id": "a.def4",
      "logical_id": "a",
      "storage": "Register",
      "dtype": "fp32",
      "shape": [],
      "producer_node_id": "instruction.2",
      "storage_object_id": null,
      "source_location": null
    },
    "out.def5": {
      "definition_id": "out.def5",
      "logical_id": "out",
      "storage": "Register",
      "dtype": "fp32",
      "shape": [],
      "producer_node_id": "instruction.3",
      "storage_object_id": null,
      "source_location": null
    }
  },
  "storage_objects": {},
  "params": {},
  "uarch": {},
  "source": {
    "adapter": "cce",
    "path": "<cce>"
  }
}
