{
  "schema_version": 2,
  "context": [
    {
      "kind": "instruction",
      "instruction_id": "instruction.0",
      "opcode": "PSET_B8",
      "instruction_class": "compute",
      "form": "b8",
      "inputs": [],
      "outputs": [
        {
          "value_id": "p.def0",
          "role": "destination",
          "dtype": "bool",
          "memory_access": null
        }
      ],
      "attributes": {},
      "source_location": {
        "source": "vf",
        "line": 4,
        "column": null,
        "path": "<cce>"
      }
    },
    {
      "kind": "instruction",
      "instruction_id": "instruction.1",
      "opcode": "VLDS",
      "instruction_class": "load",
      "form": "uint8",
      "inputs": [
        {
          "value_id": "input.def1",
          "role": "memory",
          "dtype": "uint8",
          "memory_access": {
            "base_object_id": "ub.input",
            "offset": {
              "constant": 0,
              "terms": []
            },
            "access_kind": "read",
            "span": 1,
            "address_unit_bytes": 1,
            "alias_group": null,
            "address_state_id": "vf:pointer:0:input",
            "update_mode": "none",
            "post_update_delta_bytes": null
          }
        }
      ],
      "outputs": [
        {
          "value_id": "first.def2",
          "role": "destination",
          "dtype": "uint8",
          "memory_access": null
        }
      ],
      "attributes": {
        "catalog_mode": "BRC_B8"
      },
      "source_location": {
        "source": "vf",
        "line": 5,
        "column": null,
        "path": "<cce>"
      }
    },
    {
      "kind": "instruction",
      "instruction_id": "instruction.2",
      "opcode": "VSTS",
      "instruction_class": "store",
      "form": "uint8",
      "inputs": [
        {
          "value_id": "first.def2",
          "role": "source",
          "dtype": "uint8",
          "memory_access": null
        },
        {
          "value_id": "p.def0",
          "role": "predicate",
          "dtype": "bool",
          "memory_access": null
        }
      ],
      "outputs": [
        {
          "value_id": "output.def3",
          "role": "memory",
          "dtype": "uint8",
          "memory_access": {
            "base_object_id": "ub.output",
            "offset": {
              "constant": 0,
              "terms": []
            },
            "access_kind": "write",
            "span": 1,
            "address_unit_bytes": 1,
            "alias_group": null,
            "address_state_id": "vf:pointer:1:output",
            "update_mode": "none",
            "post_update_delta_bytes": null
          }
        }
      ],
      "attributes": {
        "catalog_mode": "ONEPT_B8"
      },
      "source_location": {
        "source": "vf",
        "line": 6,
        "column": null,
        "path": "<cce>"
      }
    },
    {
      "kind": "instruction",
      "instruction_id": "instruction.3",
      "opcode": "VLDS",
      "instruction_class": "load",
      "form": "uint8",
      "inputs": [
        {
          "value_id": "input.def1",
          "role": "memory",
          "dtype": "uint8",
          "memory_access": {
            "base_object_id": "ub.input",
            "offset": {
              "constant": 0,
              "terms": []
            },
            "access_kind": "read",
            "span": 512,
            "address_unit_bytes": 1,
            "alias_group": null,
            "address_state_id": "vf:pointer:0:input",
            "update_mode": "none",
            "post_update_delta_bytes": null
          }
        }
      ],
      "outputs": [
        {
          "value_id": "first.def4",
          "role": "destination",
          "dtype": "uint8",
          "memory_access": null
        },
        {
          "value_id": "second.def5",
          "role": "destination",
          "dtype": "uint8",
          "memory_access": null
        }
      ],
      "attributes": {
        "catalog_mode": "DINTLV_B8"
      },
      "source_location": {
        "source": "vf",
        "line": 7,
        "column": null,
        "path": "<cce>"
      }
    },
    {
      "kind": "instruction",
      "instruction_id": "instruction.4",
      "opcode": "VSTS",
      "instruction_class": "store",
      "form": "uint8",
      "inputs": [
        {
          "value_id": "first.def4",
          "role": "source",
          "dtype": "uint8",
          "memory_access": null
        },
        {
          "value_id": "second.def5",
          "role": "source",
          "dtype": "uint8",
          "memory_access": null
        }
      ],
      "outputs": [
        {
          "value_id": "output.def6",
          "role": "memory",
          "dtype": "uint8",
          "memory_access": {
            "base_object_id": "ub.output",
            "offset": {
              "constant": 0,
              "terms": []
            },
            "access_kind": "write",
            "span": 512,
            "address_unit_bytes": 1,
            "alias_group": null,
            "address_state_id": "vf:pointer:1:output",
            "update_mode": "none",
            "post_update_delta_bytes": null
          }
        }
      ],
      "attributes": {
        "catalog_mode": "INTLV_B8"
      },
      "source_location": {
        "source": "vf",
        "line": 8,
        "column": null,
        "path": "<cce>"
      }
    }
  ],
  "values": {
    "p.def0": {
      "definition_id": "p.def0",
      "logical_id": "p",
      "storage": "PredicateRegister",
      "dtype": "bool",
      "shape": [],
      "producer_node_id": "instruction.0",
      "storage_object_id": null,
      "source_location": null
    },
    "input.def1": {
      "definition_id": "input.def1",
      "logical_id": "input",
      "storage": "UB",
      "dtype": "uint8",
      "shape": [],
      "producer_node_id": null,
      "storage_object_id": "ub.input",
      "source_location": null
    },
    "first.def2": {
      "definition_id": "first.def2",
      "logical_id": "first",
      "storage": "Register",
      "dtype": "uint8",
      "shape": [],
      "producer_node_id": "instruction.1",
      "storage_object_id": null,
      "source_location": null
    },
    "output.def3": {
      "definition_id": "output.def3",
      "logical_id": "output",
      "storage": "UB",
      "dtype": "uint8",
      "shape": [],
      "producer_node_id": "instruction.2",
      "storage_object_id": "ub.output",
      "source_location": null
    },
    "first.def4": {
      "definition_id": "first.def4",
      "logical_id": "first",
      "storage": "Register",
      "dtype": "uint8",
      "shape": [],
      "producer_node_id": "instruction.3",
      "storage_object_id": null,
      "source_location": null
    },
    "second.def5": {
      "definition_id": "second.def5",
      "logical_id": "second",
      "storage": "Register",
      "dtype": "uint8",
      "shape": [],
      "producer_node_id": "instruction.3",
      "storage_object_id": null,
      "source_location": null
    },
    "output.def6": {
      "definition_id": "output.def6",
      "logical_id": "output",
      "storage": "UB",
      "dtype": "uint8",
      "shape": [],
      "producer_node_id": "instruction.4",
      "storage_object_id": "ub.output",
      "source_location": null
    }
  },
  "storage_objects": {
    "ub.input": {
      "object_id": "ub.input",
      "storage": "UB",
      "shape": [],
      "source_location": null
    },
    "ub.output": {
      "object_id": "ub.output",
      "storage": "UB",
      "shape": [],
      "source_location": null
    }
  },
  "params": {},
  "uarch": {},
  "source": {
    "adapter": "cce",
    "path": "<cce>"
  }
}
